{
  "schema": "emsim/assessment-inputs/v1",
  "item_id": "019230a4-6b1e-7c0a-9a1f-3f2a1b2c3d4e",
  "evidence_digest": "9f2c1b5e0a7d4c3b8e6f1a2b3c4d5e6f7a8b9c0d1e2f3a4b5c6d7e8f9a0b1c2d",
  "rubric_version": "dds/rubric-v1",
  "rubric_effective": {
    "schema": "emsim/rubric/v1",
    "id": "dds_default",
    "version": "dds/rubric-v1",
    "pass_threshold": 70,
    "critical_cap": 40,
    "criteria": []
  },
  "transcripts": [],
  "judge": {
    "model": null,
    "prompt_versions": {},
    "parameters": {}
  },
  "semantic_input": {},
  "exercise_type": "dds_processing",
  "rule_results": [
    {"id": "T_OPEN", "status": "met"},
    {"id": "D_PRIMARY", "status": "met"},
    {"id": "D_COMMENT_CONTENT", "status": "unavailable"}
  ]
}
